icon|Home|Return unto the homepage!!!|big1 medium1 small1|/|goc-logo|media/logo-optimised.svg|A logo of a happy chao in a circle, in the colours of the Fantasy Strike logo.
text|Rules|View the tournament rules!|big5 medium4 small4|rules
text|Rulesets|View the silly rulesets you can choose to play under!|big6 medium2 small2|rulesets
text|Formats|View potential future tournament formats!|big7 medium5 small3|styles
icon|Signup|Join this week's tournament bracket!|big2 medium7 small5|bracket|challonge-logo|media/challonge.svg|The challonge logo in a circle, in the colours of the Fantasy Strike logo.
icon|Discord|Join the discord server!|big3 medium8 small6|https://discord.gg/abWADS7|discord-logo|media/discord.svg|The Discord logo in a circle, in the colours of the Fantasy Strike logo.
icon|Stream|Watch the tournament live!|big4 medium9 small7|stream|twitch-logo|media/twitch.svg|The Twitch logo in a circle, in the colours of the Fantasy Strike logo.
text|Resources|Read up on a bunch of useful Fantasy Strike knowledge!|big8 medium3 small8|resources
text|Commentators|See who our commentators are and what else they do!|big0 medium6 small0|commentators
